{
  "schema": "jqstar-program-audit-inputs/1",
  "program": "docs/LIBRARY_EXPANSION_PLAN.md",
  "tickets": [
    "0001",
    "0002",
    "0003",
    "0004",
    "0005",
    "0006",
    "0007",
    "0008",
    "0009",
    "0010",
    "0011",
    "0012",
    "0013",
    "0014",
    "0015",
    "0016",
    "0017",
    "0018",
    "0019",
    "0020",
    "0021",
    "0022",
    "0023",
    "0024",
    "0025",
    "0026",
    "0027",
    "0028",
    "0029",
    "0030",
    "0031",
    "0032",
    "0033",
    "0034",
    "0035",
    "0036",
    "0037",
    "0038",
    "0039",
    "0040",
    "0041",
    "0042",
    "0043",
    "0044",
    "0045",
    "0046",
    "0047",
    "0048",
    "0049",
    "0050",
    "0051",
    "0052",
    "0053"
  ],
  "expectedRequirements": 613,
  "claimSources": [
    "AGENTS.md",
    "CHANGELOG.md",
    "MIGRATING_TO_1.md",
    "README.md",
    "RELEASING.md",
    "SECURITY.md",
    "SUPPORT.md",
    "docs/ARCHITECTURE.md",
    "docs/BACKEND.md",
    "docs/COMPATIBILITY.md",
    "docs/COMPONENT_ARCHITECTURE.md",
    "docs/COMPONENT_RESEARCH.md",
    "docs/CSP_EXPRESSIONS.md",
    "docs/DEVELOPMENT.md",
    "docs/INSPECTION.md",
    "docs/INTEROPERABILITY.md",
    "docs/JQUERY_ECOSYSTEM.md",
    "docs/JQUERY_MOBILE_MIGRATION.md",
    "docs/JQUERY_UI_MIGRATION.md",
    "docs/LIBRARY_EXPANSION_PLAN.md",
    "docs/PERSISTENCE.md",
    "docs/PROGRAM_AUDIT.md",
    "docs/PROJECT.md",
    "docs/QUALITY_PROGRAM.md",
    "docs/README.md",
    "docs/RUNTIME_OWNERSHIP.md",
    "docs/SELF_HOSTING.md",
    "docs/STORES.md",
    "docs/TESTING.md",
    "docs/UPGRADES.md",
    "docs/accessibility/RELEASE_CHARTERS.md",
    "docs/decisions/DEVTOOLS.md",
    "docs/decisions/NATIVE_NAVIGATION.md",
    "docs/decisions/RESOURCE_STRATEGY.md",
    "docs/security/CSP_THREAT_MODEL.md",
    "docs/tickets/README.md",
    "docs/tickets/ROADMAP.md",
    "etc/jquery-star-core.api.md",
    "etc/jquery-star-csp.api.md",
    "etc/jquery-star-datastar-testing.api.md",
    "etc/jquery-star-datastar.api.md",
    "etc/jquery-star-htmx.api.md",
    "etc/jquery-star-inspect.api.md",
    "etc/jquery-star-persist.api.md",
    "etc/jquery-star-stores.api.md",
    "etc/jquery-star-testing.api.md",
    "etc/jquery-star-turbo.api.md",
    "etc/jquery-star-ui.api.md",
    "etc/jquery-star.api.md",
    "example/components/lab/index.html",
    "example/docs-shell.html",
    "example/docs/agents/index.html",
    "example/docs/api/index.html",
    "example/docs/compatibility/index.html",
    "example/docs/components/dialog/index.html",
    "example/docs/components/dropdown/index.html",
    "example/docs/components/index.html",
    "example/docs/components/tabs/index.html",
    "example/docs/components/toast/index.html",
    "example/docs/csp/index.html",
    "example/docs/datastar/index.html",
    "example/docs/download/index.html",
    "example/docs/ecosystem/index.html",
    "example/docs/ecosystem/jquery-mobile/index.html",
    "example/docs/ecosystem/jquery-ui/index.html",
    "example/docs/index.html",
    "example/docs/interoperability/index.html",
    "example/docs/migration/index.html",
    "example/docs/persistence/index.html",
    "example/docs/plugins/index.html",
    "example/docs/security/index.html",
    "example/docs/stores/index.html",
    "example/docs/testing/index.html",
    "example/index.html"
  ],
  "baselines": [
    "config/quality-budgets.json",
    "example/agent-content.generated.json",
    "package-lock.json",
    "package.json",
    "quality/coverage-thresholds.json",
    "quality/deviations.json",
    "quality/external-bridge-contract.json",
    "quality/inspection-decision.json",
    "quality/jquery-ecosystem.json",
    "quality/jquery-mobile-migration.json",
    "quality/jquery-ui-migration.json",
    "quality/licenses.json",
    "quality/lint-boundaries.json",
    "quality/metrics.json",
    "quality/navigation-decision.json",
    "quality/production-census.json",
    "quality/public-baseline.json",
    "quality/release-contract.json",
    "quality/resource-strategy.json",
    "quality/scopes.json",
    "quality/test-evidence.json",
    "registry.json"
  ]
}
